{"authentication":"chatgpt","case_evidence_sha256":"sha256:e44faf128e4022b2099f93f4b11fd7ab38c958408202381e603e7e4c8eab022e","cases":8,"codex_cli_version":"codex-cli 0.149.1","corpus_sha256":"sha256:49a581f1c941c9b349ad4ae49b4fe04d30a1141795b0eba957842c584fdc68f3","cost":"unavailable","created_at":"2026-09-03T00:00:00Z","critical_cases":7,"critical_defect_recall":"0/7","critical_detected":0,"false_blocks":0,"false_passes":0,"human_labelled":true,"label_decision_id":"sha256:e950a5cc5d14d852b9e1d4f08af3811a8c72d6b76fe14ca945ff461c457459c4","latency_ms":0,"launcher_sha256":"sha256:818565fc5c6ade9e32f1d742ca062a42dadf797253f39b8252ef76b5c8f80d3e","limitations":["Draft placeholder; exact protected qualification has not run."],"model":"gpt-5.6-sol","prompt_sha256":"sha256:c44ad418c24e95c23b194a2f64d54c7a1f257c5daa397c37082b1f97e5b4547d","qualification_id":"sha256:10bac8574132d0dd031a11ba157cccfcb07630ebdb279b3fe979b0da333443ac","qualified":false,"reasoning_effort":"xhigh","schema_sha256":"sha256:2ae6bee4391ec0f213ea39cb03705269a82d62554ff14471e3ff3d70cfa1a78e","schema_version":"3.0.0","unknowns":8}