{"authentication":"chatgpt","case_evidence_sha256":"sha256:0c541d1e2d62475198880a29471eeb3ff36af07735be79c3f325e3f008ce7ec4","cases":8,"codex_cli_version":"codex-cli 0.149.1","corpus_sha256":"sha256:49a581f1c941c9b349ad4ae49b4fe04d30a1141795b0eba957842c584fdc68f3","cost":"unavailable","created_at":"2026-09-05T00:00:00Z","critical_cases":7,"critical_defect_recall":"0/7","critical_detected":0,"false_blocks":0,"false_passes":0,"human_labelled":true,"label_decision_id":"sha256:e950a5cc5d14d852b9e1d4f08af3811a8c72d6b76fe14ca945ff461c457459c4","latency_ms":0,"launcher_sha256":"sha256:e82e8e279cb6833fea26af962746c2a387eeffaa96d76768cdd730fbdcab578e","limitations":["Draft placeholder; exact protected qualification has not run."],"model":"gpt-5.6-sol","prompt_sha256":"sha256:c44ad418c24e95c23b194a2f64d54c7a1f257c5daa397c37082b1f97e5b4547d","qualification_id":"sha256:c01a10c10408086a5a3a15ea14f1b401b56bca32c3b28f0ac778f2f2a6702569","qualified":false,"reasoning_effort":"xhigh","schema_sha256":"sha256:b41b70febd3fbca4cba4bbd2270c1f28aac7e0878ea743304bb1cdf03820fe67","schema_version":"3.0.0","unknowns":8}